NV01,Nguyen Quang Hoang,03-05-2002,Hue,0123456789,987654321,Quan Ly Nhan Vien,Quan Ly Nhan Vien,hoang123,123hoang
NV02,Anbu,1-1-2002,Hue,0123456789,987654321,Quan Ly Ve,Quan Ly Ve,anbu123,123anbu
NV03,naruto,12-3-1998,Da Nang,0123456789,987654321,Quan Ly Nguoi Dung,Quan Ly Nguoi Dung,naruto123,123naruto
NV03,Sasuke,14-6-1998,Da Nang,0123456789,987654321,Quan Ly Phong Chieu,Quan Ly Phong Chieu,sasuke123,123sasuke
NV03,SonGoKu,5-4-1989,Da Nang,0123456789,987654321,Quan Ly Lich Chieu,Quan Ly Lich Chieu,songoku123,123songoku
NV03,Vegeta,6-7-1998,Da Nang,0123456789,987654321,Quan Ly Phim,Quan Ly Phim,vegeta123,123vegeta
